item_id,title,category,price,description
101,Smartphone X,Electronics,799.99,Latest smartphone with advanced camera and long battery life
102,Running Shoes,Sports,129.99,Comfortable running shoes with cushioned soles
103,Coffee Maker,Home,89.99,Programmable coffee maker with thermal carafe
104,Wireless Headphones,Electronics,199.99,Noise-cancelling wireless headphones
105,Yoga Mat,Sports,45.99,Non-slip yoga mat with carrying strap
106,Blender,Home,69.99,High-speed blender for smoothies and soups
107,Smart Watch,Electronics,249.99,Fitness tracking smartwatch with heart rate monitor